{"type":"config","name":"Optimize trees fileListToTree speed","metricName":"total_ms","metricUnit":"ms","bestDirection":"lower"}
{"run":1,"commit":"77f3426","metric":0,"metrics":{},"status":"crash","description":"Tried to run baseline with prefixed env command; run_experiment rejected because autoresearch.sh must be run directly.","timestamp":1774484346834,"segment":0,"confidence":null,"asi":{"hypothesis":"Baseline run using autoresearch.sh should produce total_ms metric.","rollback_reason":"Invalid run_experiment command format rejected before benchmark execution.","next_action_hint":"Run with command './autoresearch.sh' directly."}}
{"run":2,"commit":"1cd199e","metric":251.52125,"metrics":{"worst_case_ms":208.851541,"buildPathGraph_ms":98.074583,"buildFlattenedNodes_ms":5.93404,"buildFolderNodes_ms":35.060291,"hashTreeKeys_ms":110.869667},"status":"keep","description":"Baseline measurement from autoresearch.sh on current main implementation.","timestamp":1774484368561,"segment":0,"confidence":null,"asi":{"hypothesis":"Establish a stable baseline using benchmark medians across all cases.","baseline_note":"First non-crash datapoint; previous crash metric=0 is not a real performance baseline.","bottleneck":"hashTreeKeys and buildPathGraph dominate total stage medians."}}
{"run":3,"commit":"ff1e153","metric":218.407876,"metrics":{"worst_case_ms":180.085334,"buildPathGraph_ms":68.823999,"buildFlattenedNodes_ms":5.530586,"buildFolderNodes_ms":33.332375,"hashTreeKeys_ms":108.885915},"status":"keep","description":"Fast-pathed normalized paths in buildPathGraph and reduced hashTreeKeys mapping overhead with precomputed key IDs and loop-based remapping.","timestamp":1774484468346,"segment":0,"confidence":null,"asi":{"hypothesis":"Most benchmark paths are already normalized, so skipping normalizeInputPath and reducing callback-heavy array mapping should cut path graph and hashing costs.","observed_effect":"Large buildPathGraph win (~29ms total stage medians), moderate folder/hash improvements.","bottleneck":"hashTreeKeys remains the largest stage after buildPathGraph improvements."}}
{"run":4,"commit":"ff1e153","metric":222.7275,"metrics":{"worst_case_ms":185.405209,"buildPathGraph_ms":73.051833,"buildFlattenedNodes_ms":5.437459,"buildFolderNodes_ms":34.324209,"hashTreeKeys_ms":108.665957},"status":"discard","description":"Tried minor micro-optimizations (string concatenation and explicit node construction in hashTreeKeys).","timestamp":1774484537524,"segment":0,"confidence":50.561779451174395,"asi":{"hypothesis":"Reducing template-string and object spread overhead would shave CPU in hot loops.","rollback_reason":"Primary metric regressed (~+4.3ms) with no compensating stage win.","next_action_hint":"Pursue structural algorithmic changes, especially reducing per-folder sorting and flatten traversal work.","finding":"hashTreeKeys flat; regression mostly in buildPathGraph noise/overhead."}}
{"run":5,"commit":"ff1e153","metric":221.042666,"metrics":{"worst_case_ms":183.227292,"buildPathGraph_ms":69.936789,"buildFlattenedNodes_ms":5.342751,"buildFolderNodes_ms":32.723917,"hashTreeKeys_ms":112.459875},"status":"discard","description":"Added cached sorted-children lookup in stage context so flatten and folder-node stages reuse sorted arrays.","timestamp":1774484599410,"segment":0,"confidence":101.12355890234814,"asi":{"hypothesis":"Avoiding duplicate sortChildren calls per folder should reduce buildFlattenedNodes/buildFolderNodes time.","rollback_reason":"Primary metric regressed (~+2.6ms), with hashTreeKeys worsening enough to offset small folder-stage gains.","next_action_hint":"Target hashTreeKeys directly (ID remap and key ordering strategy) or reduce file-node object churn in buildPathGraph."}}
{"run":6,"commit":"ff1e153","metric":229.701876,"metrics":{"worst_case_ms":191.019583,"buildPathGraph_ms":82.17779,"buildFlattenedNodes_ms":4.937582,"buildFolderNodes_ms":33.327085,"hashTreeKeys_ms":107.857584},"status":"discard","description":"Replaced segment scanning with path.split('/') loop in buildPathGraph.","timestamp":1774484672356,"segment":0,"confidence":50.561779451174395,"asi":{"hypothesis":"Native split iteration might outperform repeated indexOf/slice scanning.","rollback_reason":"Major regression in buildPathGraph caused higher total runtime (~+11.3ms).","next_action_hint":"Keep indexOf-based parsing; focus on reducing normalization overhead and hashTreeKeys sort/remap costs instead."}}
{"run":7,"commit":"1004edb","metric":218.037624,"metrics":{"worst_case_ms":180.807833,"buildPathGraph_ms":70.838457,"buildFlattenedNodes_ms":5.351456,"buildFolderNodes_ms":33.325583,"hashTreeKeys_ms":107.723627},"status":"keep","description":"Switched hashId to a lightweight FNV-1a variant to reduce per-key hashing cost in ID mapping.","timestamp":1774484743805,"segment":0,"confidence":59.53517170612255,"asi":{"hypothesis":"A simpler hash function can lower hashTreeKeys cost while collision suffixing preserves uniqueness.","observed_effect":"Small but consistent total_ms improvement after rerun; hashTreeKeys down ~1.16% vs original baseline and slightly better than prior best.","risk_note":"ID values changed; behavior validated by full trees test suite in checks."}}
{"run":8,"commit":"654c830","metric":213.331832,"metrics":{"worst_case_ms":176.544458,"buildPathGraph_ms":72.648792,"buildFlattenedNodes_ms":5.376791,"buildFolderNodes_ms":33.930584,"hashTreeKeys_ms":101.394583},"status":"keep","description":"Made createIdMaps reverse lookup optional and disabled keyById map construction for fileListToTree hashing path.","timestamp":1774484818915,"segment":0,"confidence":70.99129795856423,"asi":{"hypothesis":"fileListToTree only needs key->id mapping, so skipping id->key bookkeeping should reduce hashTreeKeys overhead and memory churn.","observed_effect":"Significant drop in hashTreeKeys stage (~6.3ms vs prior best), yielding new best total_ms.","correctness_guard":"lazy loader still uses reverse map via default includeReverseMap=true; trees tests passed in checks."}}
{"run":9,"commit":"7626f5a","metric":196.093624,"metrics":{"worst_case_ms":163.972583,"buildPathGraph_ms":75.925128,"buildFlattenedNodes_ms":5.7505,"buildFolderNodes_ms":36.519292,"hashTreeKeys_ms":77.517583},"status":"keep","description":"Removed key sorting in hashTreeKeys and hashed IDs in existing object-key insertion order.","timestamp":1774484863332,"segment":0,"confidence":41.74128417479204,"asi":{"hypothesis":"Object.keys(...).sort() is a major hot cost; insertion-order mapping should preserve determinism for identical input while avoiding global sort.","observed_effect":"Large hashTreeKeys reduction (~23.9ms stage sum) and major total_ms improvement.","tradeoff":"Slight regressions in buildPathGraph/folder stages likely noise or shifted runtime profile; overall win is substantial."}}
{"run":10,"commit":"7626f5a","metric":222.984917,"metrics":{"worst_case_ms":191.307667,"buildPathGraph_ms":78.269209,"buildFlattenedNodes_ms":5.862959,"buildFolderNodes_ms":58.583499,"hashTreeKeys_ms":75.443248},"status":"discard","description":"Replaced localeCompare with simple lowercased lexical comparison in defaultChildrenComparator.","timestamp":1774484917308,"segment":0,"confidence":65.25486964907638,"asi":{"hypothesis":"Avoiding localeCompare would speed child sorting hot paths.","rollback_reason":"Severe regression in buildFolderNodes (~+22ms stage sum) and overall total_ms.","next_action_hint":"Keep localeCompare behavior; focus on reducing number of sorts/allocations rather than comparator semantics.","surprise":"Comparator simplification unexpectedly worsened folder stage significantly."}}
{"run":11,"commit":"7626f5a","metric":201.109042,"metrics":{"worst_case_ms":166.168667,"buildPathGraph_ms":77.298623,"buildFlattenedNodes_ms":5.922416,"buildFolderNodes_ms":36.4475,"hashTreeKeys_ms":80.838248},"status":"discard","description":"Swapped mappedKeys cache from Map to null-prototype object in hashTreeKeys.","timestamp":1774484947374,"segment":0,"confidence":40.628177209669225,"asi":{"hypothesis":"Property lookup could be faster than Map.get in dense remapping loops.","rollback_reason":"Primary metric regressed (~+5.0ms), mainly from hashTreeKeys worsening.","next_action_hint":"Revert to Map-based cache; explore reducing remap passes or avoiding repeated child array allocation instead."}}
{"run":12,"commit":"d685a5d","metric":192.607125,"metrics":{"worst_case_ms":160.832791,"buildPathGraph_ms":76.581332,"buildFlattenedNodes_ms":5.946751,"buildFolderNodes_ms":35.847375,"hashTreeKeys_ms":72.519916},"status":"keep","description":"Simplified hashTreeKeys remapping by removing precomputed mappedKeys pass and using getIdForKey directly during node/child remap.","timestamp":1774485006527,"segment":0,"confidence":37.944337164926104,"asi":{"hypothesis":"Eliminating the upfront key->id prefill pass and extra lookup layer reduces hash remap overhead.","observed_effect":"New best; hashTreeKeys dropped substantially (~72.5ms stage sum) with strong total_ms gain.","determinism_note":"ID generation order remains deterministic for a fixed input order because getIdForKey memoizes assignments."}}
{"run":13,"commit":"f7aae08","metric":187.928165,"metrics":{"worst_case_ms":155.760042,"buildPathGraph_ms":72.571418,"buildFlattenedNodes_ms":5.840292,"buildFolderNodes_ms":35.849001,"hashTreeKeys_ms":71.279708},"status":"keep","description":"Removed normalizeInputPath fallback from buildPathGraph path ingestion and handled empty path segments inline while scanning.","timestamp":1774485073763,"segment":0,"confidence":22.960007315801953,"asi":{"hypothesis":"Avoiding a second full-string normalization pass per path should lower buildPathGraph overhead while still collapsing duplicate/leading separators.","observed_effect":"New best total_ms with buildPathGraph and hashTreeKeys both improved.","correctness_note":"Inline segment-skip preserves normalization semantics for repeated and leading separators; tests passed."}}
{"run":14,"commit":"4ab6c57","metric":163.04225,"metrics":{"worst_case_ms":134.523167,"buildPathGraph_ms":68.25396,"buildFlattenedNodes_ms":5.657334,"buildFolderNodes_ms":33.983459,"hashTreeKeys_ms":55.443542},"status":"keep","description":"Mutated node child/flatten arrays in-place during hashTreeKeys remap instead of allocating replacement arrays/objects.","timestamp":1774485140204,"segment":0,"confidence":13.977943034838404,"asi":{"hypothesis":"Reusing existing node objects and arrays should cut allocation/GC overhead in hashTreeKeys.","observed_effect":"Major win; hashTreeKeys dropped to ~55.44ms stage sum and total_ms improved dramatically.","safety_note":"Mutation is safe because source tree object is not reused after hashing; checks/test suite passed."}}
{"run":15,"commit":"4ab6c57","metric":164.331082,"metrics":{"worst_case_ms":136.069667,"buildPathGraph_ms":68.055585,"buildFlattenedNodes_ms":5.436666,"buildFolderNodes_ms":33.671915,"hashTreeKeys_ms":56.361834},"status":"discard","description":"Trimmed trailing slash once in resolvePathGraphInput for directory paths before segment scanning.","timestamp":1774485184800,"segment":0,"confidence":11.404413427504243,"asi":{"hypothesis":"Removing trailing empty-segment handling in the hot loop would speed buildPathGraph for explicit-directory inputs.","rollback_reason":"Primary metric slightly regressed (~+1.29ms) despite minor stage deltas.","next_action_hint":"Keep raw-path scan; focus on larger wins (buildPathGraph data structures or flatten stage pruning)."}}
{"run":16,"commit":"ec1b4f7","metric":162.133666,"metrics":{"worst_case_ms":134.46925,"buildPathGraph_ms":66.311294,"buildFlattenedNodes_ms":5.568793,"buildFolderNodes_ms":32.996542,"hashTreeKeys_ms":54.38275},"status":"keep","description":"Confirmation rerun on current best commit (no code changes) to validate measurement stability.","timestamp":1774485206805,"segment":0,"confidence":9.904290177839469,"asi":{"hypothesis":"Re-run best implementation to estimate noise and validate gain durability.","observed_effect":"Improved further with same code, indicating previous gains are robust and not a one-off.","noise_note":"Current environment appears slightly faster; continue evaluating future changes against this tightened baseline."}}
{"run":17,"commit":"ec1b4f7","metric":162.783625,"metrics":{"worst_case_ms":134.876792,"buildPathGraph_ms":67.6275,"buildFlattenedNodes_ms":5.455918,"buildFolderNodes_ms":34.42854,"hashTreeKeys_ms":53.867709},"status":"discard","description":"Used null-prototype objects for intermediate/final tree records to reduce prototype overhead.","timestamp":1774485240449,"segment":0,"confidence":10.36940620422856,"asi":{"hypothesis":"Object.create(null) might improve hot-path dictionary performance and avoid prototype key edge cases.","rollback_reason":"Primary metric regressed slightly (~+0.65ms) versus current best.","next_action_hint":"Keep standard object records; pursue larger structural wins in buildPathGraph or folder-node sorting path."}}
{"run":18,"commit":"0a0ce6a","metric":154.949332,"metrics":{"worst_case_ms":127.9395,"buildPathGraph_ms":68.811499,"buildFlattenedNodes_ms":5.361374,"buildFolderNodes_ms":23.645293,"hashTreeKeys_ms":57.01475},"status":"keep","description":"Added default-comparator fast path in sortChildren using decorate-sort-undecorate with precomputed folder/dot/lowercase keys.","timestamp":1774485305152,"segment":0,"confidence":7.16745532914512,"asi":{"hypothesis":"Precomputing sort keys once per child avoids repeated basename/lowercase work in comparator callbacks.","observed_effect":"Large buildFolderNodes drop (~9.35ms stage sum) and new best total_ms.","behavior_note":"Sorting semantics preserved (folder-first, dot-first, case-insensitive alphabetical) with localeCompare on precomputed lowercased names."}}
{"run":19,"commit":"831c3fd","metric":152.959793,"metrics":{"worst_case_ms":126.015875,"buildPathGraph_ms":67.821332,"buildFlattenedNodes_ms":5.401166,"buildFolderNodes_ms":23.201668,"hashTreeKeys_ms":55.256541},"status":"keep","description":"Cached and reused root folder child set in buildPathGraph to avoid repeated Map lookups for first path segment.","timestamp":1774485352878,"segment":0,"confidence":6.3063524279891725,"asi":{"hypothesis":"Root-parent lookup happens for every input path; bypassing Map.get(rootId) in hot loop should shave path-graph overhead.","observed_effect":"New best total_ms with small but broad stage improvements, especially buildPathGraph and hashTreeKeys.","complexity":"Low-risk/localized change."}}
{"run":20,"commit":"831c3fd","metric":157.773291,"metrics":{"worst_case_ms":130.662417,"buildPathGraph_ms":69.554876,"buildFlattenedNodes_ms":5.636375,"buildFolderNodes_ms":25.102499,"hashTreeKeys_ms":57.283126},"status":"discard","description":"Added single-entry parent-children cache in buildPathGraph for non-root parent lookups.","timestamp":1774485394872,"segment":0,"confidence":5.688078777022735,"asi":{"hypothesis":"Many consecutive segments reuse the same parent path; memoizing last parent set lookup should reduce Map.get overhead.","rollback_reason":"Primary metric regressed (~+4.81ms) with worse path/folder/hash stages.","next_action_hint":"Remove this cache; its branch/state overhead outweighs lookup savings."}}
{"run":21,"commit":"831c3fd","metric":170.383875,"metrics":{"worst_case_ms":142.5915,"buildPathGraph_ms":75.900085,"buildFlattenedNodes_ms":5.668707,"buildFolderNodes_ms":22.434249,"hashTreeKeys_ms":67.148876},"status":"discard","description":"Micro-optimized sortChildren default fast path with manual loops/preallocated arrays.","timestamp":1774485431896,"segment":0,"confidence":5.3659118691282615,"asi":{"hypothesis":"Replacing Array.map() with indexed loops would further reduce sorting overhead.","rollback_reason":"Large regression (~+17.4ms total), with broader stage slowdowns despite slightly better folder stage.","next_action_hint":"Keep simpler map-based decorated implementation; avoid this manual preallocation variant."}}
{"run":22,"commit":"831c3fd","metric":156.594627,"metrics":{"worst_case_ms":128.432125,"buildPathGraph_ms":69.405041,"buildFlattenedNodes_ms":5.518083,"buildFolderNodes_ms":24.499417,"hashTreeKeys_ms":57.0055},"status":"discard","description":"Refactored buildPathGraph hot loop to branch on currentPath null instead of comparing parentPath to rootId.","timestamp":1774485490655,"segment":0,"confidence":5.173699973363662,"asi":{"hypothesis":"Reducing per-segment rootId comparisons and simplifying branch structure would improve path graph speed.","rollback_reason":"Primary metric regressed (~+3.63ms).","next_action_hint":"Keep previous root-child lookup optimization without this control-flow rewrite."}}
{"run":23,"commit":"831c3fd","metric":200.582082,"metrics":{"worst_case_ms":169.32575,"buildPathGraph_ms":82.443252,"buildFlattenedNodes_ms":6.405499,"buildFolderNodes_ms":29.928999,"hashTreeKeys_ms":81.449583},"status":"discard","description":"Changed default sort fast path to lexical string comparison instead of localeCompare on precomputed lowercase names.","timestamp":1774485548061,"segment":0,"confidence":5.3659118691282615,"asi":{"hypothesis":"Replacing localeCompare with < > checks would reduce comparator overhead.","rollback_reason":"Massive regression (~+47.6ms) across stages; change is clearly harmful in this runtime.","next_action_hint":"Keep localeCompare-based decorated sort; do not pursue lexical compare variant."}}
{"run":24,"commit":"831c3fd","metric":176.763,"metrics":{"worst_case_ms":148.413917,"buildPathGraph_ms":75.902456,"buildFlattenedNodes_ms":6.138459,"buildFolderNodes_ms":26.308541,"hashTreeKeys_ms":67.358626},"status":"discard","description":"Tried iterating hashTreeKeys with for..in + Object.hasOwn instead of Object.keys array.","timestamp":1774485621599,"segment":0,"confidence":5.379176467927935,"asi":{"hypothesis":"Avoiding Object.keys allocation might reduce hashTreeKeys overhead.","rollback_reason":"Large regression (~+23.8ms), including slower hashTreeKeys and upstream stages.","next_action_hint":"Keep Object.keys iteration; focus on algorithmic reductions, not for-in enumeration."}}
{"run":25,"commit":"831c3fd","metric":165.907958,"metrics":{"worst_case_ms":137.613,"buildPathGraph_ms":77.032917,"buildFlattenedNodes_ms":4.651207,"buildFolderNodes_ms":24.854332,"hashTreeKeys_ms":60.513083},"status":"discard","description":"Tried array-first folderChildren accumulation with a post-pass dedupe (instead of Set.add on every edge).","timestamp":1774485747240,"segment":0,"confidence":5.5366053414523,"asi":{"hypothesis":"Appending to arrays and deduping once per folder could outperform per-insert Set overhead in buildPathGraph.","rollback_reason":"Primary metric regressed (~+12.95ms), with large buildPathGraph slowdown dominating gains elsewhere.","next_action_hint":"Keep Set-based folderChildren; postpone specialized child-store refactor unless profiling shows a better uniqueness strategy."}}
{"run":26,"commit":"831c3fd","metric":153.927166,"metrics":{"worst_case_ms":127.253208,"buildPathGraph_ms":68.039249,"buildFlattenedNodes_ms":5.283748,"buildFolderNodes_ms":23.968417,"hashTreeKeys_ms":54.471208},"status":"discard","description":"Confirmation rerun on current best implementation (no code change).","timestamp":1774485775387,"segment":0,"confidence":5.929938511308166,"asi":{"hypothesis":"Check measurement variance after recent regressions.","rollback_reason":"Result was slightly slower than best (~+0.97ms), so no new primary improvement.","next_action_hint":"Continue with structural changes targeting hashTreeKeys elimination or buildPathGraph data structure redesign.","noise_note":"Current best remains credible; this run stays close to best and within expected variance band."}}
{"run":27,"commit":"831c3fd","metric":159.683749,"metrics":{"worst_case_ms":132.897416,"buildPathGraph_ms":68.298751,"buildFlattenedNodes_ms":6.500416,"buildFolderNodes_ms":55.380582,"hashTreeKeys_ms":28.311958},"status":"discard","description":"Pre-hashed node references during folder/flattened node construction and simplified hashTreeKeys to remap only top-level keys.","timestamp":1774485878774,"segment":0,"confidence":6.4766646148309075,"asi":{"hypothesis":"Shifting child/flattens ID remap earlier would nearly eliminate hashTreeKeys stage and improve total runtime.","rollback_reason":"Primary metric regressed (~+6.72ms); buildFolderNodes cost ballooned (~+32ms), outweighing hashTreeKeys savings.","next_action_hint":"Keep remap concentrated in hashTreeKeys; avoid adding hash mapping work inside folder-node construction hot path.","insight":"Moving work between stages can hurt cache/locality despite reducing a headline stage time."}}
{"run":28,"commit":"831c3fd","metric":165.124999,"metrics":{"worst_case_ms":137.543208,"buildPathGraph_ms":72.455293,"buildFlattenedNodes_ms":5.455416,"buildFolderNodes_ms":25.662124,"hashTreeKeys_ms":62.329249},"status":"discard","description":"Special-cased root parent handling in buildPathGraph to bypass nullable parentChildren path.","timestamp":1774485952762,"segment":0,"confidence":7.584141417852594,"asi":{"hypothesis":"Removing per-segment null checks/temporary for root parent could shave hot-loop overhead.","rollback_reason":"Primary metric regressed significantly (~+12.17ms).","next_action_hint":"Keep prior root-child optimization as-is; this branch restructuring harms runtime."}}
