{"run":54,"commit":"90bc02e","metric":93.566959,"metrics":{"worst_case_ms":76.055791,"buildPathGraph_ms":36.034835,"buildFlattenedNodes_ms":3.678667,"buildFolderNodes_ms":15.771709,"hashTreeKeys_ms":37.849665},"status":"keep","description":"Skipped redundant parentChildren.add for folders already registered in buildPathGraph, saving thousands of no-op Set operations.","timestamp":1774489515821,"segment":0,"confidence":6.261382642805584,"asi":{"hypothesis":"When multiple file paths share a folder prefix, the folder is added to its parent's children Set on every path. Moving the Set.add inside the new-folder branch saves one Set operation per duplicate folder encounter.","observed_effect":"buildPathGraph dropped ~3.7ms (39.7 → 36.0ms). Total improved by ~5.3ms.","correctness_note":"Folders are added to parent's children exactly once (on first creation). Files are still always added. Output unchanged because Set dedup was already a no-op for duplicates."}}
{"run":55,"commit":"90bc02e","metric":95.630624,"metrics":{"worst_case_ms":77.724,"buildPathGraph_ms":36.796998,"buildFlattenedNodes_ms":3.797375,"buildFolderNodes_ms":15.463583,"hashTreeKeys_ms":39.329168},"status":"discard","description":"Added sortChildrenSet to avoid intermediate spread-to-array step in buildFolderNodes sort.","timestamp":1774489710609,"segment":0,"confidence":6.250228137067535,"asi":{"hypothesis":"Building decorated sort array directly from Set (pre-allocated, no intermediate spread) would reduce allocation overhead in buildFolderNodes.","rollback_reason":"Primary metric regressed +2.06ms. buildFolderNodes improved only ~0.3ms — Set spread is already fast in JSC.","next_action_hint":"The spread-to-array overhead is negligible. Focus optimization efforts on buildPathGraph and hashTreeKeys Map operations."}}
{"run":56,"commit":"e582e61","metric":78.662207,"metrics":{"worst_case_ms":64.343167,"buildPathGraph_ms":22.166086,"buildFlattenedNodes_ms":3.480707,"buildFolderNodes_ms":14.232791,"hashTreeKeys_ms":37.356998},"status":"keep","description":"Added prefix reuse in buildPathGraph: consecutive paths sharing directory prefixes skip already-processed segments via a depth-tracked parent stack.","timestamp":1774490049197,"segment":0,"confidence":5.245253532145046,"asi":{"hypothesis":"Consecutive file paths typically share deep directory prefixes (64.4% on average for Linux kernel fixture). By comparing characters with the previous path and reusing the parent-children Set stack, we skip redundant segment scanning, string creation, and Map/Set operations for shared prefix segments.","observed_effect":"buildPathGraph dropped from 36.0ms to 22.2ms (-38%). Total improved by 14.9ms. Minor cascade improvements in other stages from reduced GC pressure.","mechanism":"prevPath character comparison + reuseDepth counting lets us jump directly to the first divergent segment, reusing parentStack[reuseDepth] as the starting parentChildren Set.","correctness_note":"Double-slash (empty segment) detection in the common prefix disables reuse to maintain normalization semantics. reuseDepth capped at prevDepth to prevent stale stack entries."}}
{"run":57,"commit":"e582e61","metric":78.828167,"metrics":{"worst_case_ms":64.398,"buildPathGraph_ms":22.452833,"buildFlattenedNodes_ms":3.392666,"buildFolderNodes_ms":14.540457,"hashTreeKeys_ms":37.019501},"status":"discard","description":"Confirmation rerun on prefix-reuse implementation (no code change).","timestamp":1774490190523,"segment":0,"confidence":5.14104720180247,"asi":{"hypothesis":"Verify 78.66ms baseline stability.","rollback_reason":"Slightly slower than best (78.83 vs 78.66); within noise. Confirms baseline is in the 78-79ms range.","noise_note":"Noise floor is ~0.5-1ms based on rerun delta."}}
{"run":58,"commit":"e582e61","metric":93.524124,"metrics":{"worst_case_ms":77.969083,"buildPathGraph_ms":24.61654,"buildFlattenedNodes_ms":3.778957,"buildFolderNodes_ms":16.851875,"hashTreeKeys_ms":49.21175},"status":"discard","description":"Switched hashId from FNV-1a to Bun.hash.xxHash32 native hash function.","timestamp":1774490332694,"segment":0,"confidence":4.779947618931589,"asi":{"hypothesis":"Bun's native xxHash32 should be faster than JS FNV-1a loop for per-key hash computation.","rollback_reason":"hashTreeKeys regressed from 37.4ms to 49.2ms (+31.5%). The JS-to-native call boundary overhead for 99K small strings (~39 chars) exceeds the per-byte speedup.","next_action_hint":"Keep FNV-1a — JIT-compiled JS loop is faster than native calls for many small strings. Focus on reducing total Map operations or structural changes.","finding":"Native hash functions are only faster for bulk hashing (micro-benchmark). For 99K individual small-string calls, the per-call overhead of crossing JS-native boundary dominates."}}
{"run":59,"commit":"e582e61","metric":78.621167,"metrics":{"worst_case_ms":64.533792,"buildPathGraph_ms":22.399958,"buildFlattenedNodes_ms":3.405375,"buildFolderNodes_ms":14.838749,"hashTreeKeys_ms":36.954419},"status":"discard","description":"Inlined getIdForKey for tree keys to skip Map.get miss on first encounter.","timestamp":1774490442689,"segment":0,"confidence":4.439275799822498,"asi":{"hypothesis":"Skipping the getIdForKey function call and Map.get miss for tree keys saves per-key overhead.","rollback_reason":"No measurable improvement (0.04ms difference, within noise). Function call overhead is negligible in JIT-compiled code.","next_action_hint":"hashTreeKeys internal optimizations are exhausted. Consider structural changes: e.g. pre-sorting input paths to maximize prefix sharing in buildPathGraph, or reducing sortChildren overhead in buildFolderNodes."}}
{"run":60,"commit":"7c73f0e","metric":77.753083,"metrics":{"worst_case_ms":63.527583,"buildPathGraph_ms":20.82596,"buildFlattenedNodes_ms":3.354458,"buildFolderNodes_ms":14.724334,"hashTreeKeys_ms":37.807709},"status":"keep","description":"Added pathStack to store currentPath at each depth, reusing it in prefix reuse instead of re-slicing from the new path string.","timestamp":1774490702690,"segment":0,"confidence":4.315989092498668,"asi":{"hypothesis":"Reusing the stored folder path string from the previous path's processing avoids a path.slice allocation per prefix-reused path.","observed_effect":"buildPathGraph improved by ~1.3ms (22.2 → 20.8ms). Total improved by ~0.9ms.","mechanism":"pathStack[reuseDepth] provides the same content as path.slice(0, commonPrefixLen-1) without string allocation."}}
{"run":61,"commit":"7c73f0e","metric":80.994707,"metrics":{"worst_case_ms":66.305458,"buildPathGraph_ms":21.230751,"buildFlattenedNodes_ms":3.516665,"buildFolderNodes_ms":17.860708,"hashTreeKeys_ms":38.469291},"status":"discard","description":"Switched sort comparisons from pre-lowered localeCompare to Intl.Collator with sensitivity: base.","timestamp":1774490785132,"segment":0,"confidence":4.096791246334112,"asi":{"hypothesis":"Intl.Collator avoids per-call locale setup and eliminates toLowerCase() allocations per child.","rollback_reason":"buildFolderNodes regressed +3.1ms (14.7 → 17.9ms). Intl.Collator.compare with sensitivity:base is slower per comparison than localeCompare on pre-lowered strings. The O(n) toLowerCase savings don't offset the O(n log n) slower comparisons.","next_action_hint":"Keep pre-lowered localeCompare pattern. The sort is already well-optimized.","finding":"Pre-computing toLowerCase() once per child then using fast localeCompare on lowered strings is faster than case-insensitive collator per comparison."}}
{"run":62,"commit":"7c73f0e","metric":77.672333,"metrics":{"worst_case_ms":63.592458,"buildPathGraph_ms":21.199583,"buildFlattenedNodes_ms":3.425376,"buildFolderNodes_ms":15.172042,"hashTreeKeys_ms":37.002624},"status":"discard","description":"Replaced [...children] with Array.from(children) in buildFolderNodes Set-to-Array conversion.","timestamp":1774490949838,"segment":0,"confidence":3.898782249234879,"asi":{"hypothesis":"Array.from might use optimized pre-sizing for Set-to-Array conversion.","rollback_reason":"No measurable difference (0.08ms within noise). Both operations are equivalent in JSC for Set iteration.","next_action_hint":"Micro-optimizations for buildFolderNodes Set-to-Array are exhausted. The sort dominates this stage."}}
{"run":63,"commit":"1670c22","metric":77.325042,"metrics":{"worst_case_ms":63.20975,"buildPathGraph_ms":21.106999,"buildFlattenedNodes_ms":3.519125,"buildFolderNodes_ms":14.66775,"hashTreeKeys_ms":36.852584},"status":"keep","description":"Used Object.create(null) for hashedTree output to avoid prototype chain overhead during 99K property insertions.","timestamp":1774491015681,"segment":0,"confidence":3.5151542730251224,"asi":{"hypothesis":"Null-prototype objects avoid prototype chain lookup during property insertion, potentially faster hash table operations for the output object.","observed_effect":"hashTreeKeys improved ~1ms (37.8 → 36.9ms). Confirmed on rerun (77.53ms). Total improved ~0.3-0.4ms.","risk_note":"Null-prototype objects work correctly with Object.entries/keys but lack toString/hasOwnProperty methods. Tests pass because they use Object.entries."}}
{"run":64,"commit":"1670c22","metric":76.795791,"metrics":{"worst_case_ms":62.86675,"buildPathGraph_ms":20.127209,"buildFlattenedNodes_ms":3.367331,"buildFolderNodes_ms":14.679042,"hashTreeKeys_ms":37.480291},"status":"keep","description":"Inlined resolvePathGraphInput to avoid creating a PathGraphInput object for every file path.","timestamp":1774491073876,"segment":0,"confidence":3.1550782535158874,"asi":{"hypothesis":"Eliminating 92K PathGraphInput object allocations per tree build reduces GC pressure and allocation overhead in buildPathGraph.","observed_effect":"buildPathGraph improved ~1.0ms (21.1 → 20.1ms). Total improved ~0.53ms.","previous_attempts":"Runs 37/46 tried this on different code baselines and regressed. Current baseline (prefix reuse, path.slice) benefits more from reduced allocations."}}
{"run":65,"commit":"d4e5a0c","metric":77.752209,"metrics":{"worst_case_ms":63.61875,"buildPathGraph_ms":20.071957,"buildFlattenedNodes_ms":3.394416,"buildFolderNodes_ms":14.730956,"hashTreeKeys_ms":37.91175},"status":"discard","description":"Separated file node processing (inline hash) from folder/flattened nodes in hashTreeKeys.","timestamp":1774491266571,"segment":0,"confidence":3.1169679542303363,"asi":{"hypothesis":"Inlining hash for file nodes skips the Map.get miss in getIdForKey, saving ~1.4ms for 92K file keys.","rollback_reason":"Primary regressed +0.95ms. The additional branch and inlined code disrupts JIT optimization of the main loop. Map.get miss with cached string hashes is cheap (~10-15ns).","next_action_hint":"hashTreeKeys micro-optimizations are exhausted. The simple single-loop pattern is optimal for JIT compilation.","finding":"JS engine's JIT optimizes a uniform loop body better than a branched one. Inlining breaks the hot loop's monomorphic call pattern."}}
{"run":66,"commit":"d4e5a0c","metric":76.796375,"metrics":{"worst_case_ms":63.024333,"buildPathGraph_ms":19.597583,"buildFlattenedNodes_ms":3.315083,"buildFolderNodes_ms":14.498127,"hashTreeKeys_ms":38.479582},"status":"discard","description":"Added single-file-segment fast path after prefix reuse to skip segment loop overhead.","timestamp":1774491378301,"segment":0,"confidence":2.9683596108112633,"asi":{"hypothesis":"When the divergent suffix after prefix reuse is a single file segment, processing directly avoids loop control, empty-segment checks, and isFile branching.","rollback_reason":"No net improvement; buildPathGraph gained 0.5ms but hashTreeKeys noise offset it. Total unchanged at 76.80ms.","next_action_hint":"buildPathGraph at ~20ms is near optimal for 92K paths with 64% prefix sharing. Focus remaining effort on hashTreeKeys structural improvements or accept current performance level."}}
{"run":67,"commit":"d4e5a0c","metric":77.024167,"metrics":{"worst_case_ms":63.125584,"buildPathGraph_ms":20.473208,"buildFlattenedNodes_ms":3.438081,"buildFolderNodes_ms":14.949416,"hashTreeKeys_ms":37.241292},"status":"discard","description":"Replaced charCodeAt slash-counting loop with indexOf-based scanning in prefix reuse.","timestamp":1774491471802,"segment":0,"confidence":2.4237557557294065,"asi":{"hypothesis":"indexOf uses native/SIMD scanning that's faster than per-character charCodeAt for slash counting.","rollback_reason":"No improvement (+0.22ms). For short prefixes (~25 chars, ~5 slashes), the indexOf function call overhead per slash matches the charCodeAt loop cost.","next_action_hint":"The prefix comparison and slash counting are already near-optimal. Focus on entirely different optimization vectors."}}
{"run":68,"commit":"d4e5a0c","metric":77.023252,"metrics":{"worst_case_ms":62.94175,"buildPathGraph_ms":20.223626,"buildFlattenedNodes_ms":3.394751,"buildFolderNodes_ms":14.953416,"hashTreeKeys_ms":37.297249},"status":"discard","description":"Stability rerun on current best (no code change). Confirms 76.8-77.0ms range.","timestamp":1774491573108,"segment":0,"confidence":2.0541117734498666,"asi":{"hypothesis":"Verify baseline stability.","rollback_reason":"Slightly above best (77.02 vs 76.80). Confirms noise floor of ~0.5-1ms.","session_summary":"This session achieved total_ms from 132.77ms → 76.80ms (-42.1%). Key wins: path.slice for currentPath (-24ms), prefix reuse (-15ms), removed usedIds (-10ms), skip redundant folder adds (-5ms). hashTreeKeys at ~37ms is now the dominant stage and resists further micro-optimization."}}
{"run":69,"commit":"8d90f95","metric":75.760333,"metrics":{"worst_case_ms":61.81175,"buildPathGraph_ms":19.878123,"buildFlattenedNodes_ms":3.426084,"buildFolderNodes_ms":14.509834,"hashTreeKeys_ms":36.694916},"status":"keep","description":"Inlined hashId function definition from ./hashId into fileListToTree.ts to enable JIT cross-function inlining.","timestamp":1774491633280,"segment":0,"confidence":2.047402538351808,"asi":{"hypothesis":"Cross-module function imports may prevent JSC from inlining hashId into the getIdForKey hot loop. A local function definition in the same module allows the JIT to inline it.","observed_effect":"hashTreeKeys improved ~0.8ms (37.5 → 36.7ms). Confirmed on rerun. Total improved ~1ms.","risk_note":"hashId.ts still exists and is used by other callers (e.g. createIdMaps). The local copy must be kept in sync if the hash algorithm changes."}}
{"run":70,"commit":"8d90f95","metric":79.718166,"metrics":{"worst_case_ms":65.346458,"buildPathGraph_ms":19.822124,"buildFlattenedNodes_ms":3.366582,"buildFolderNodes_ms":14.475292,"hashTreeKeys_ms":40.595042},"status":"discard","description":"Replaced charCodeAt-based FNV-1a with TextEncoder.encodeInto + Uint8Array hashing.","timestamp":1774491764150,"segment":0,"confidence":2.0688286942001732,"asi":{"hypothesis":"Typed array access in hash loop enables tighter JIT code than charCodeAt.","rollback_reason":"hashTreeKeys regressed +3.9ms. encodeInto overhead and the extra data pass negate any typed-array loop benefit. charCodeAt is the fastest approach for small strings in JSC.","next_action_hint":"The FNV-1a charCodeAt loop is optimal for JSC. No further hash-computation optimizations are viable."}}
{"run":71,"commit":"4c8e055","metric":72.454292,"metrics":{"worst_case_ms":59.196958,"buildPathGraph_ms":20.008749,"buildFlattenedNodes_ms":3.416748,"buildFolderNodes_ms":14.727583,"hashTreeKeys_ms":32.669207},"status":"keep","description":"Replaced idByKey Map with Symbol-property ID caching on tree nodes, eliminating string-keyed Map overhead for ~200K lookups.","timestamp":1774492069085,"segment":0,"confidence":1.8319881891928906,"asi":{"hypothesis":"Symbol properties on nodes provide O(1) identity-based ID caching that's faster than string-keyed Map.get/set. Symbol properties are invisible in Object.keys/entries/JSON output.","observed_effect":"hashTreeKeys dropped 4.0ms (36.7 → 32.7ms). Total improved 3.3ms. Symbol property access (~5ns) replaces Map.get (~50-100ns) for cached ID lookups.","mechanism":"resolveId() stores the computed ID on the node via tree[key][NODE_ID]. Subsequent lookups for the same node (child references) read the cached Symbol property instead of doing a Map lookup.","session_final":"Total reduction this session: 251.5ms → 72.5ms (71.2%). Key wins: path.slice (-24ms), prefix reuse (-15ms), usedIds removal (-10ms), folder add skip (-5ms), Symbol ID cache (-3.3ms), inline hashId (-1ms), pathStack (-1ms), Object.create(null) (-0.5ms), inline resolvePathGraphInput (-0.5ms)."}}
{"run":72,"commit":"b9ee4d0","metric":71.481001,"metrics":{"worst_case_ms":58.17025,"buildPathGraph_ms":19.669081,"buildFlattenedNodes_ms":3.323458,"buildFolderNodes_ms":15.190332,"hashTreeKeys_ms":32.691125},"status":"keep","description":"Baseline calibration rerun on Symbol-ID code — new best from favorable environment conditions.","timestamp":1774492151870,"segment":0,"confidence":1.6592731083506878,"asi":{"hypothesis":"Re-baseline after context resume to calibrate noise floor.","profile_snapshot":"buildPathGraph=19.7ms(28%) hashTreeKeys=32.7ms(46%) buildFolderNodes=15.2ms(21%) buildFlattenedNodes=3.3ms(5%)","noise_note":"71.48 vs previous best 72.45 — environment trending faster. Current stable range ~71-73ms."}}
{"run":73,"commit":"31b73aa","metric":69.696041,"metrics":{"worst_case_ms":56.835167,"buildPathGraph_ms":19.706459,"buildFlattenedNodes_ms":3.248582,"buildFolderNodes_ms":14.537794,"hashTreeKeys_ms":30.746041},"status":"keep","description":"Split resolveId into assignId (takes node directly) for tree keys and resolveId (does tree[key] lookup) for child references, eliminating ~99K redundant property accesses.","timestamp":1774492199930,"segment":0,"confidence":1.578737760986886,"asi":{"hypothesis":"The outer loop already holds the node reference via tree[key]. Passing it to assignId avoids the redundant tree[key] lookup inside resolveId for every tree key.","observed_effect":"hashTreeKeys dropped ~2ms (32.7 → 30.7ms). For 99K tree keys, saving one ~20ns property access each = ~2ms.","mechanism":"assignId(key, node) reads node[NODE_ID] directly; resolveId(key) first does tree[key] then reads node[NODE_ID]. Both cache the result."}}
{"run":74,"commit":"a034e2b","metric":68.879623,"metrics":{"worst_case_ms":56.091208,"buildPathGraph_ms":19.783084,"buildFlattenedNodes_ms":3.332417,"buildFolderNodes_ms":13.391457,"hashTreeKeys_ms":31.306292},"status":"keep","description":"Passed parentPathLength to sortChildren so child names are extracted via direct slice instead of backward lastIndexOf scan.","timestamp":1774492373654,"segment":0,"confidence":1.5298522607277867,"asi":{"hypothesis":"When the parent folder path length is known, child names can be extracted as path.slice(parentLen+1) instead of scanning backwards with lastIndexOf('/') for each child. Root folder is excluded (its children have no parent prefix).","observed_effect":"buildFolderNodes dropped ~1.1ms (14.5 → 13.4ms). Avoids ~92K lastIndexOf backward scans in getNameFromPath.","correctness_note":"Initial attempt failed for root-level children that don't have a root/ prefix. Fixed by passing undefined for the root folder."}}
{"run":75,"commit":"d096e9a","metric":65.460541,"metrics":{"worst_case_ms":53.251667,"buildPathGraph_ms":17.506584,"buildFlattenedNodes_ms":3.278376,"buildFolderNodes_ms":12.986458,"hashTreeKeys_ms":30.445708},"status":"keep","description":"Fused prefix comparison, slash counting, double-slash detection, and boundary back-up into a single character scan loop in buildPathGraph.","timestamp":1774492451193,"segment":0,"confidence":1.4705180802870854,"asi":{"hypothesis":"Three separate loops (character compare, back-up to last slash, count slashes) scanned the same prefix characters redundantly. A single-pass scan that tracks lastSlashPos and reuseDepth while comparing eliminates two full passes over ~25 chars × 92K paths.","observed_effect":"buildPathGraph dropped 2.3ms (19.8 → 17.5ms). Total improved 3.4ms. hashTreeKeys also improved 0.9ms (likely GC/cache effects).","mechanism":"Combined loop compares chars, counts '/' as reuseDepth, records lastSlashPos for segment boundary, and detects consecutive slashes — all in one pass. commonPrefixLen snaps to lastSlashPos instead of a separate back-up scan."}}
{"run":76,"commit":"d096e9a","metric":65.798918,"metrics":{"worst_case_ms":53.29475,"buildPathGraph_ms":17.401793,"buildFlattenedNodes_ms":3.389666,"buildFolderNodes_ms":13.075999,"hashTreeKeys_ms":30.43275},"status":"discard","description":"Confirmation rerun — confirms stable 65-66ms range.","timestamp":1774492538032,"segment":0,"confidence":1.475115961612058,"asi":{"hypothesis":"Verify baseline stability.","rollback_reason":"Slightly above best (65.80 vs 65.46). Confirms noise floor ~0.5ms.","profile_snapshot":"buildPathGraph=17.4ms(26%) hashTreeKeys=30.4ms(46%) buildFolderNodes=13.1ms(20%) buildFlattenedNodes=3.4ms(5%)"}}
{"run":77,"commit":"d096e9a","metric":65.483459,"metrics":{"worst_case_ms":53.330708,"buildPathGraph_ms":17.142583,"buildFlattenedNodes_ms":3.408166,"buildFolderNodes_ms":12.895793,"hashTreeKeys_ms":30.573248},"status":"discard","description":"Replaced decorated-object sort with parallel-array index sort (numeric sortGroup + separate lowerNames + indices).","timestamp":1774492650514,"segment":0,"confidence":1.4697408214534944,"asi":{"hypothesis":"Parallel arrays avoid 92K per-child object allocations. A combined numeric sortGroup (folder+dot) reduces comparator branches to one subtraction.","rollback_reason":"No improvement (65.48 vs 65.46). JSC optimizes object-based decorated sort equally well; parallel array element lookups have similar overhead to object field access.","next_action_hint":"The decorated sort is near-optimal for JSC. Further buildFolderNodes gains require reducing the number of sorts or total children processed."}}
