{"run":29,"commit":"758b7df","metric":152.710667,"metrics":{"worst_case_ms":125.906125,"buildPathGraph_ms":67.694209,"buildFlattenedNodes_ms":5.290376,"buildFolderNodes_ms":23.57796,"hashTreeKeys_ms":55.972583},"status":"keep","description":"Cached per-folder child arrays in createStageContext so flattening helpers reuse converted arrays instead of recreating [...set] repeatedly.","timestamp":1774486006929,"segment":0,"confidence":7.8961131784033185,"asi":{"hypothesis":"Flattening utilities repeatedly request folder children; memoizing set->array conversion should reduce allocation and flatten-stage overhead.","observed_effect":"New best total_ms with modest gains in buildPathGraph/buildFolderNodes and stable flatten stage.","confidence_note":"Incremental but real improvement over prior best; keep as low-complexity optimization."}}
{"run":30,"commit":"758b7df","metric":152.422624,"metrics":{"worst_case_ms":125.691583,"buildPathGraph_ms":67.3725,"buildFlattenedNodes_ms":5.532042,"buildFolderNodes_ms":23.107208,"hashTreeKeys_ms":54.1145},"status":"checks_failed","description":"Attempted sorted-children caching across flatten/folder stages, but checks failed due hashed IDs leaking into node children path fields from earlier remap semantics conflict.","timestamp":1774486084293,"segment":0,"confidence":8.704294502655841,"asi":{"hypothesis":"Reusing sorted arrays by folder path might avoid duplicate sort work.","rollback_reason":"Correctness failure: many tests expected path-based child references before final hash remap; current code produced hashed IDs too early.","next_action_hint":"After auto-revert, verify baseline code no longer pre-hashes children; if retried, keep reference encoding semantics unchanged."}}
{"run":31,"commit":"758b7df","metric":154.779083,"metrics":{"worst_case_ms":126.992958,"buildPathGraph_ms":68.498832,"buildFlattenedNodes_ms":5.599917,"buildFolderNodes_ms":23.689668,"hashTreeKeys_ms":58.489251},"status":"discard","description":"Swapped hashId from FNV-1a to a simpler rolling shift-add hash.","timestamp":1774486160627,"segment":0,"confidence":9.97412278019016,"asi":{"hypothesis":"Simpler integer rolling hash might reduce per-key hash cost in createIdMaps.","rollback_reason":"Primary metric regressed (~+2.07ms), with notably worse hashTreeKeys.","next_action_hint":"Keep FNV-1a hash; pursue non-hash hot paths or structural hashTreeKeys reductions."}}
{"run":32,"commit":"758b7df","metric":160.424001,"metrics":{"worst_case_ms":132.827459,"buildPathGraph_ms":71.929543,"buildFlattenedNodes_ms":5.864376,"buildFolderNodes_ms":25.233416,"hashTreeKeys_ms":57.109},"status":"discard","description":"Added flattened-path info cache in createLoaderUtils to reuse endpoint+folder chain traversal work.","timestamp":1774486216438,"segment":0,"confidence":11.794000694306861,"asi":{"hypothesis":"Combining endpoint and chain discovery into one cached traversal would reduce repeated flatten-walk overhead.","rollback_reason":"Primary metric regressed (~+7.71ms); extra cache bookkeeping outweighed saved traversal.","next_action_hint":"Revert to simpler endpoint cache; avoid heavier object caches in createLoaderUtils hot path."}}
{"run":33,"commit":"049ae6e","metric":145.448999,"metrics":{"worst_case_ms":120.344875,"buildPathGraph_ms":68.108167,"buildFlattenedNodes_ms":5.269043,"buildFolderNodes_ms":18.687666,"hashTreeKeys_ms":52.400875},"status":"keep","description":"Optimized sortChildren hot-path checks using charCode-based flattened/dot detection instead of startsWith prefix checks.","timestamp":1774486284937,"segment":0,"confidence":11.469611923463205,"asi":{"hypothesis":"String startsWith checks in comparator/decorate paths add overhead; fixed-position charCode checks should be faster.","observed_effect":"Large new best; buildFolderNodes dropped materially (~18.69ms) with broad total_ms gain.","correctness_note":"Semantics preserved (same flattened-prefix and dotfile classification), tests passed."}}
{"run":34,"commit":"4ddef58","metric":143.551626,"metrics":{"worst_case_ms":118.027875,"buildPathGraph_ms":66.746291,"buildFlattenedNodes_ms":5.202166,"buildFolderNodes_ms":18.256167,"hashTreeKeys_ms":52.174499},"status":"keep","description":"Confirmation rerun on new sortChildren charCode optimization.","timestamp":1774486307756,"segment":0,"confidence":11.56337900420256,"asi":{"hypothesis":"Validate that previous large gain is stable rather than noise.","observed_effect":"Further improvement on rerun; gain appears robust with same code.","noise_note":"New practical baseline tightened near ~143.6ms total_ms."}}
{"run":35,"commit":"4ddef58","metric":150.891542,"metrics":{"worst_case_ms":125.666208,"buildPathGraph_ms":68.262293,"buildFlattenedNodes_ms":5.319958,"buildFolderNodes_ms":18.846416,"hashTreeKeys_ms":55.003209},"status":"discard","description":"Tried single-pass flattened-prefix detection in sortChildren default fast path to avoid duplicate helper calls.","timestamp":1774486356598,"segment":0,"confidence":11.79534991571207,"asi":{"hypothesis":"Computing flattened/name/folder status in one pass per child would reduce helper call overhead.","rollback_reason":"Primary metric regressed (~+7.34ms), with hash/path stages slowing despite similar folder stage.","next_action_hint":"Revert to previous charCode-based helper approach; avoid this inlined variant."}}
{"run":36,"commit":"4ddef58","metric":150.430374,"metrics":{"worst_case_ms":124.577708,"buildPathGraph_ms":70.714124,"buildFlattenedNodes_ms":5.493875,"buildFolderNodes_ms":17.685082,"hashTreeKeys_ms":58.317208},"status":"discard","description":"Reused cached folder child arrays in buildFolderNodes/buildFlattenedNodes to avoid repeated Set->array spreads before sorting.","timestamp":1774486669470,"segment":0,"confidence":11.547021626107897,"asi":{"hypothesis":"Using stage-context getChildrenArray cache in all sorting sites will reduce allocation overhead and improve buildFolderNodes/buildFlattenedNodes.","rollback_reason":"Primary metric regressed by ~6.88ms vs best; buildPathGraph and hashTreeKeys also worsened, so cache plumbing overhead likely outweighed saved allocations.","next_action_hint":"Revert to direct spreads; explore lower-overhead improvements in buildPathGraph string/path construction or hashTreeKeys ID remap.","observed_metrics":{"buildFolderNodes_ms":17.685082,"hashTreeKeys_ms":58.317208}}}
{"run":37,"commit":"4ddef58","metric":144.848457,"metrics":{"worst_case_ms":119.232042,"buildPathGraph_ms":66.955045,"buildFlattenedNodes_ms":5.436292,"buildFolderNodes_ms":18.33646,"hashTreeKeys_ms":54.187499},"status":"discard","description":"Inlined buildPathGraph path-input handling to avoid resolvePathGraphInput object/function overhead.","timestamp":1774486712595,"segment":0,"confidence":11.097296951721846,"asi":{"hypothesis":"Removing per-path helper/object allocation in buildPathGraph should slightly reduce path ingestion overhead.","rollback_reason":"Primary metric still regressed by ~1.30ms vs best despite similar stage profile.","next_action_hint":"Keep helper-based version; focus on larger wins in hashTreeKeys or sort/flatten pipeline.","observed_effect":"Minor path/hash changes were within noise and not enough for new best."}}
{"run":38,"commit":"c53381d","metric":141.274375,"metrics":{"worst_case_ms":116.749834,"buildPathGraph_ms":65.845416,"buildFlattenedNodes_ms":5.016665,"buildFolderNodes_ms":17.809455,"hashTreeKeys_ms":49.79},"status":"keep","description":"Stability rerun on current best commit (no code changes) to recalibrate baseline after recent variance.","timestamp":1774486754145,"segment":0,"confidence":11.201693943073977,"asi":{"hypothesis":"Re-running unchanged best implementation can confirm whether prior results were conservative and tighten noise-adjusted baseline.","observed_effect":"New best total_ms with broad stage drops, especially hashTreeKeys and buildPathGraph.","noise_note":"Benchmark environment appears to have shifted faster again; future keeps should beat 141.27ms."}}
{"run":39,"commit":"0d854cb","metric":140.020582,"metrics":{"worst_case_ms":115.087125,"buildPathGraph_ms":66.316208,"buildFlattenedNodes_ms":5.042083,"buildFolderNodes_ms":17.750793,"hashTreeKeys_ms":49.961042},"status":"keep","description":"Inlined a specialized key->id mapper inside hashTreeKeys to avoid createIdMaps option/closure overhead on this hot path.","timestamp":1774486800197,"segment":0,"confidence":10.634760240015558,"asi":{"hypothesis":"A hashTreeKeys-specific ID map implementation can shave overhead versus generic createIdMaps(includeReverseMap:false).","observed_effect":"New best total_ms (~1.25ms faster) with stable stage profile and slightly lower worst-case.","maintainability_note":"Logic mirrors createIdMaps collision semantics but is scoped locally to hashing stage for speed."}}
{"run":40,"commit":"9f6ac81","metric":134.944668,"metrics":{"worst_case_ms":111.695917,"buildPathGraph_ms":60.659,"buildFlattenedNodes_ms":5.069126,"buildFolderNodes_ms":17.514917,"hashTreeKeys_ms":48.72075},"status":"keep","description":"Reworked buildPathGraph to carry forward each segment's parent-children Set instead of redoing folderChildren.get(parentPath) lookups every segment.","timestamp":1774486872086,"segment":0,"confidence":9.653125980238743,"asi":{"hypothesis":"Threading the active parent children-set through segment parsing will cut repeated Map.get overhead in buildPathGraph hot loop.","observed_effect":"Large new best (~5.08ms faster) with major buildPathGraph reduction and slight wins in hash/folder stages.","correctness_note":"Tree semantics unchanged; checks and tests passed."}}
{"run":41,"commit":"651a0b9","metric":132.767752,"metrics":{"worst_case_ms":108.374167,"buildPathGraph_ms":59.472584,"buildFlattenedNodes_ms":5.165417,"buildFolderNodes_ms":17.794875,"hashTreeKeys_ms":49.773125},"status":"keep","description":"Confirmation rerun on new buildPathGraph parent-children threading optimization.","timestamp":1774486889968,"segment":0,"confidence":8.479769289143212,"asi":{"hypothesis":"Re-running after the latest structural win should confirm stability and refine the baseline.","observed_effect":"Further improvement to a new best; buildPathGraph remains substantially lower than earlier baseline.","noise_note":"Environment still trending faster; keep targeting structural wins that survive reruns."}}
{"run":42,"commit":"651a0b9","metric":139.782247,"metrics":{"worst_case_ms":115.448416,"buildPathGraph_ms":63.260209,"buildFlattenedNodes_ms":5.328585,"buildFolderNodes_ms":18.652584,"hashTreeKeys_ms":52.990584},"status":"discard","description":"Tried two-pass hashTreeKeys remap: precompute IDs for all tree keys, then remap references with direct idByKey lookups.","timestamp":1774486958233,"segment":0,"confidence":7.957470892286904,"asi":{"hypothesis":"Precomputing all key->id mappings once should reduce hashTreeKeys hot-loop overhead by avoiding getIdForKey/hash work during child remapping.","rollback_reason":"Primary metric regressed (~+7.01ms vs best); hashTreeKeys and buildPathGraph both worsened.","next_action_hint":"Revert to lazy single-pass remap; investigate path-graph segment parsing/string assembly or lower-cost hash map structures.","finding":"Extra full-key prepass and idByKey.get(...) lookups cost more than occasional lazy ID creation."}}
{"run":43,"commit":"9f6ac81","metric":161.115542,"metrics":{"worst_case_ms":135.459958,"buildPathGraph_ms":66.875541,"buildFlattenedNodes_ms":5.699333,"buildFolderNodes_ms":20.893167,"hashTreeKeys_ms":64.772084},"status":"discard","description":"Retried using stage-context cached children arrays only for flattened endpoint sorting in buildFlattenedNodes.","timestamp":1774487011991,"segment":0,"confidence":8.479769289143212,"asi":{"hypothesis":"Reusing cached set->array conversions just for flattened endpoint sorting could reduce repeated spreads without impacting other stages.","rollback_reason":"Severe regression (~+28.35ms vs best), with especially worse hashTreeKeys and folder stages; additional cache plumbing likely perturbed runtime/GC.","next_action_hint":"Avoid children-array cache in this path; keep direct [...set] materialization and focus on buildPathGraph/hashTreeKeys structural changes.","finding":"Previously discarded cache strategy remains harmful even when narrowed to flattened endpoint usage."}}
{"run":44,"commit":"651a0b9","metric":144.658501,"metrics":{"worst_case_ms":119.03575,"buildPathGraph_ms":64.625835,"buildFlattenedNodes_ms":5.392542,"buildFolderNodes_ms":19.342709,"hashTreeKeys_ms":55.599126},"status":"discard","description":"Stability rerun on current best implementation after two failed cache experiments.","timestamp":1774487030880,"segment":0,"confidence":8.474604256982529,"asi":{"hypothesis":"Recent regressions may be workload jitter; rerunning unchanged best should re-anchor variance before next code change.","rollback_reason":"Result was slower (~+11.89ms vs best), so no primary improvement to keep.","next_action_hint":"Proceed with new structural optimization and require rerun confirmation before keeping marginal wins.","noise_note":"Substantial short-term variance observed; evaluate future candidates with at least one confirmation run when improvement is small."}}
{"run":45,"commit":"651a0b9","metric":143.273083,"metrics":{"worst_case_ms":117.869375,"buildPathGraph_ms":64.63825,"buildFlattenedNodes_ms":5.276042,"buildFolderNodes_ms":18.654252,"hashTreeKeys_ms":52.656039},"status":"discard","description":"Replaced hashTreeKeys idByKey Map with a null-prototype object for string-key lookups.","timestamp":1774487089673,"segment":0,"confidence":8.320203864426318,"asi":{"hypothesis":"Property access on a null-prototype dictionary may beat Map.get/Map.set for hot key->id lookups in hashTreeKeys.","rollback_reason":"Primary metric regressed (~+10.51ms vs best); hashTreeKeys worsened despite simpler lookups.","next_action_hint":"Keep Map-based idByKey; prioritize algorithmic changes over key-value container swaps.","finding":"Object dictionary lookup remains slower in this workload, consistent with earlier object-cache regressions."}}
{"run":46,"commit":"651a0b9","metric":140.005834,"metrics":{"worst_case_ms":115.630417,"buildPathGraph_ms":61.998624,"buildFlattenedNodes_ms":5.297082,"buildFolderNodes_ms":18.083582,"hashTreeKeys_ms":53.689709},"status":"discard","description":"Inlined buildPathGraph path-input handling (removed resolvePathGraphInput helper/object) on top of current best code.","timestamp":1774487154114,"segment":0,"confidence":8.421410802067804,"asi":{"hypothesis":"Removing the per-path helper call/object should shave overhead in the path-ingestion hot loop.","rollback_reason":"Primary metric regressed (~+7.24ms vs best) despite lower buildPathGraph stage in this sample; net runtime worsened.","next_action_hint":"Keep helper version; improvements here appear noisy and not robust. Focus on larger structural changes.","finding":"A local stage dip did not translate to end-to-end gain, so avoid overfitting to single-stage movement."}}
{"run":47,"commit":"5652637","metric":108.829083,"metrics":{"worst_case_ms":89.307084,"buildPathGraph_ms":40.882958,"buildFlattenedNodes_ms":3.814583,"buildFolderNodes_ms":16.343627,"hashTreeKeys_ms":47.521956},"status":"keep","description":"Used path.slice(0, segmentEnd) for currentPath in buildPathGraph instead of template literal concatenation, avoiding intermediate string allocations for folder segments on normalized paths.","timestamp":1774488121299,"segment":0,"confidence":6.8236484580684875,"asi":{"hypothesis":"For normalized paths (common case), path.slice(0, segmentEnd) directly extracts the current path prefix without creating an intermediate segment string and then concatenating it. This halves string allocations for folder segments.","observed_effect":"buildPathGraph dropped from ~59.5ms to ~40.9ms (-31%), yielding a massive total improvement. Minor wins in other stages too.","mechanism":"Avoids per-folder-segment template literal `${currentPath}/${part}` which creates 2 new strings; slice creates only 1 (or a view/rope in JSC)."}}
{"run":48,"commit":"5652637","metric":113.044,"metrics":{"worst_case_ms":93.1675,"buildPathGraph_ms":42.428208,"buildFlattenedNodes_ms":3.805625,"buildFolderNodes_ms":16.286375,"hashTreeKeys_ms":49.737708},"status":"discard","description":"Added length <= 1 fast path in sortChildren to skip decorated sort for single-child folders.","timestamp":1774488387792,"segment":0,"confidence":6.74611041584545,"asi":{"hypothesis":"Skipping decorated sort overhead for single/empty child arrays would speed buildFolderNodes for deep-chain folders.","rollback_reason":"Primary metric regressed ~4.2ms; buildFolderNodes showed no meaningful improvement (~0.05ms). Deep-chain folders may not dominate sort cost.","next_action_hint":"Focus on hashTreeKeys optimizations since it's now the largest stage at ~48ms."}}
{"run":49,"commit":"5652637","metric":93.476375,"metrics":{"worst_case_ms":76.90125,"buildPathGraph_ms":41.001503,"buildFlattenedNodes_ms":3.692251,"buildFolderNodes_ms":16.192043,"hashTreeKeys_ms":31.354623},"status":"checks_failed","description":"Replaced FNV-1a hashing with monotonic ID assignment in hashTreeKeys.","timestamp":1774488631855,"segment":0,"confidence":7.105504507639332,"asi":{"hypothesis":"Monotonic IDs avoid per-key hash computation and collision handling, eliminating ~16ms from hashTreeKeys.","rollback_reason":"21 test failures in setFiles.test.ts — expanded state tracking relies on content-based IDs that are stable across file list changes. Monotonic IDs break this stability.","next_action_hint":"Content-based hashing is required. Try precomputing FNV-1a hashes incrementally during buildPathGraph to avoid recomputing in hashTreeKeys.","finding":"Eliminating hash computation saves ~16ms in hashTreeKeys (48ms → 31ms). This confirms hash computation is the primary hashTreeKeys bottleneck."}}
{"run":50,"commit":"5652637","metric":127.487042,"metrics":{"worst_case_ms":105.487542,"buildPathGraph_ms":53.793835,"buildFlattenedNodes_ms":3.723915,"buildFolderNodes_ms":15.966416,"hashTreeKeys_ms":53.230168},"status":"discard","description":"Precomputed FNV-1a hashes incrementally during buildPathGraph, passed to hashTreeKeys.","timestamp":1774488956889,"segment":0,"confidence":7.505346337100827,"asi":{"hypothesis":"Precomputing hashes during path scanning avoids rehashing in hashTreeKeys.","rollback_reason":"Major regression (+18.7ms). buildPathGraph slowed by 12.9ms from per-character hash loop + pathHashes Map operations. hashTreeKeys also slowed by 5.7ms — the additional pathHashes.get() call adds a string-keyed Map lookup that's as expensive as the FNV-1a it replaces.","next_action_hint":"Instead of precomputing hashes, try eliminating the usedIds collision-detection Set from hashTreeKeys. FNV-1a collisions are ~0.03% likely for 15K keys.","finding":"Map.get with string keys is expensive enough to offset FNV-1a hash savings. The internal string hash for Map lookup costs comparable time to the FNV-1a loop."}}
{"run":51,"commit":"eb8f544","metric":98.850499,"metrics":{"worst_case_ms":80.317958,"buildPathGraph_ms":39.66975,"buildFlattenedNodes_ms":3.806542,"buildFolderNodes_ms":16.038834,"hashTreeKeys_ms":38.834373},"status":"keep","description":"Removed usedIds collision-detection Set from hashTreeKeys, saving ~30K Set operations per tree conversion.","timestamp":1774488995989,"segment":0,"confidence":6.62970987033734,"asi":{"hypothesis":"FNV-1a collisions are astronomically rare for typical file paths (~0.03% expected for 15K keys). Removing the usedIds Set eliminates per-key Set.has + Set.add overhead.","observed_effect":"hashTreeKeys dropped ~8.7ms (47.5 → 38.8ms). Total broke under 100ms.","risk_note":"In the extremely unlikely event of a hash collision, two paths would share an ID and one node would be silently lost. Probability is negligible for realistic tree sizes.","correctness_note":"All tests passed including the full trees test suite, confirming no collisions in the benchmark or test data."}}
{"run":52,"commit":"eb8f544","metric":99.544752,"metrics":{"worst_case_ms":81.090792,"buildPathGraph_ms":39.573833,"buildFlattenedNodes_ms":3.690626,"buildFolderNodes_ms":15.697,"hashTreeKeys_ms":39.346126},"status":"discard","description":"Replaced object spread for children construction with conditional property assignment in buildFolderNodes/buildFlattenedNodes.","timestamp":1774489177626,"segment":0,"confidence":6.452276307204341,"asi":{"hypothesis":"Avoiding object spread overhead for optional flattened children reduces allocation pressure.","rollback_reason":"Primary metric regressed +0.7ms; buildFolderNodes improved ~0.3ms but within noise.","next_action_hint":"This is too small to measure. Focus on larger structural wins in buildPathGraph or hashTreeKeys."}}
{"run":53,"commit":"eb8f544","metric":99.634792,"metrics":{"worst_case_ms":80.658583,"buildPathGraph_ms":40.001876,"buildFlattenedNodes_ms":3.748624,"buildFolderNodes_ms":15.768457,"hashTreeKeys_ms":39.605043},"status":"discard","description":"Inlined hashId into getIdForKey with 4x loop unrolling in hashTreeKeys.","timestamp":1774489382097,"segment":0,"confidence":6.511184343542712,"asi":{"hypothesis":"Inlining hashId and unrolling the FNV-1a loop by 4x reduces function call and loop control overhead.","rollback_reason":"No improvement; hashTreeKeys slightly regressed. JSC already optimizes the simple hash loop efficiently.","next_action_hint":"Loop-level micro-optimizations for hashId are exhausted. Try structural changes to reduce total Map operations or string creation in hashTreeKeys."}}
