{"run":78,"commit":"d096e9a","metric":65.124666,"metrics":{"worst_case_ms":52.852958,"buildPathGraph_ms":17.100083,"buildFlattenedNodes_ms":3.217374,"buildFolderNodes_ms":13.141043,"hashTreeKeys_ms":30.205208},"status":"discard","description":"Replaced incremental hashedTree property insertion with batched Object.fromEntries construction.","timestamp":1774492722103,"segment":0,"confidence":1.465914697010298,"asi":{"hypothesis":"Object.fromEntries may pre-size the output hash table, avoiding resize overhead during 99K insertions.","rollback_reason":"No clear improvement (-0.34ms, within noise). Tuple array creation [key, node] for 99K entries offsets any batch benefit.","next_action_hint":"hashTreeKeys output construction is already efficient with Object.create(null). No further output construction optimizations are viable."}}
{"run":79,"commit":"854ca0b","metric":63.482167,"metrics":{"worst_case_ms":51.798958,"buildPathGraph_ms":22.183418,"buildFlattenedNodes_ms":3.366374,"buildFolderNodes_ms":13.395001,"hashTreeKeys_ms":23.393334},"status":"keep","description":"Added incremental FNV-1a hash during buildPathGraph with hashStack for prefix reuse. File node IDs are pre-computed via NODE_ID symbol, eliminating ~93K hashId calls from hashTreeKeys.","timestamp":1774492888433,"segment":0,"confidence":1.3755982296429758,"asi":{"hypothesis":"With prefix reuse, the hash only needs to process divergent suffix characters (~14 avg) instead of full paths (~39 avg). Storing the ID on the node via NODE_ID symbol means hashTreeKeys skips hash computation for file nodes entirely (cache hit).","observed_effect":"hashTreeKeys dropped 7ms (30.4 → 23.4ms). buildPathGraph increased ~5ms (17.5 → 22.2ms) from added hash ops. Net improvement: 2ms total. The hash work is cheaper in buildPathGraph because prefix reuse avoids rehashing shared prefixes.","correctness_note":"Used hashNeedsSep flag instead of segmentStart>0 to correctly handle leading-slash edge cases. Folder/flattened nodes still compute hash on demand in hashTreeKeys via fallback."}}
{"run":80,"commit":"854ca0b","metric":63.691168,"metrics":{"worst_case_ms":51.999667,"buildPathGraph_ms":18.863501,"buildFlattenedNodes_ms":3.227919,"buildFolderNodes_ms":13.193669,"hashTreeKeys_ms":26.942916},"status":"discard","description":"Deferred toString(36) from buildPathGraph to hashTreeKeys by storing raw hash number via NODE_HASH symbol.","timestamp":1774493003338,"segment":0,"confidence":1.3607076081064362,"asi":{"hypothesis":"Deferring toString(36) + template literal from buildPathGraph to hashTreeKeys reduces allocation pressure during path scanning.","rollback_reason":"Net neutral (+0.21ms). buildPathGraph improved -3.3ms but hashTreeKeys increased +3.5ms. The work just moved between stages. Extra NODE_HASH symbol check adds ~0.5ms overhead.","next_action_hint":"The ID string must be created somewhere. Splitting between two symbols adds complexity without net benefit. Keep the single NODE_ID approach."}}
{"run":81,"commit":"854ca0b","metric":64.509834,"metrics":{"worst_case_ms":52.601917,"buildPathGraph_ms":22.50004,"buildFlattenedNodes_ms":3.595707,"buildFolderNodes_ms":15.259125,"hashTreeKeys_ms":21.843792},"status":"discard","description":"Pre-computed NODE_ID on folder/flattened nodes during buildFolderNodes/buildFlattenedNodes for 100% hashTreeKeys cache hits.","timestamp":1774493088931,"segment":0,"confidence":1.3477612820891003,"asi":{"hypothesis":"Pre-computing all node IDs makes hashTreeKeys loop fully monomorphic (always cache hit), enabling better JIT optimization.","rollback_reason":"Net regression +1.0ms. hashTreeKeys improved 1.6ms but buildFolderNodes regressed 1.9ms from ~6K hashId calls moved there. The JIT benefit (~0.5ms estimated) didn't offset the stage shift cost.","next_action_hint":"Keep folder/flattened hash computation in hashTreeKeys. The current split (files pre-computed, folders computed on demand) is the optimal balance."}}
{"run":82,"commit":"854ca0b","metric":63.868042,"metrics":{"worst_case_ms":52.293541,"buildPathGraph_ms":21.939752,"buildFlattenedNodes_ms":3.503626,"buildFolderNodes_ms":13.334167,"hashTreeKeys_ms":22.9415},"status":"discard","description":"Final confirmation rerun — stable at ~63.5-63.9ms range. All practical optimization paths exhausted.","timestamp":1774493223024,"segment":0,"confidence":1.3653118910692081,"asi":{"hypothesis":"Final baseline validation.","rollback_reason":"Slightly above best (63.87 vs 63.48). Confirms noise floor ~0.5ms.","session_summary":"Total reduction: 251.5ms → 63.5ms (74.8%). Profile: buildPathGraph=22ms(35%) hashTreeKeys=23ms(36%) buildFolderNodes=13ms(21%) buildFlattenedNodes=3.4ms(5%). All stages near fundamental limits for JS with content-based hashing and locale-aware sorting. Numeric-ID approach disproven via micro-benchmark (JSC string Map.get >= number Map.get)."}}
{"run":83,"commit":"2433555","metric":63.157125,"metrics":{"worst_case_ms":51.658542,"buildPathGraph_ms":22.069124,"buildFlattenedNodes_ms":3.49125,"buildFolderNodes_ms":13.823376,"hashTreeKeys_ms":22.813125},"status":"keep","description":"Baseline calibration after context resume — new best from favorable environment.","timestamp":1774493313683,"segment":0,"confidence":1.357839342771542,"asi":{"hypothesis":"Re-baseline to calibrate noise floor for new session.","profile_snapshot":"buildPathGraph=22.1ms(35%) hashTreeKeys=22.8ms(36%) buildFolderNodes=13.8ms(22%) buildFlattenedNodes=3.5ms(6%)"}}
{"run":84,"commit":"f908306","metric":57.723083,"metrics":{"worst_case_ms":47.051083,"buildPathGraph_ms":22.353626,"buildFlattenedNodes_ms":3.392417,"buildFolderNodes_ms":13.591042,"hashTreeKeys_ms":17.154041},"status":"keep","description":"Passed treeEntries array to hashTreeKeys, avoiding Object.keys allocation and ~99K tree[key] hash-table lookups.","timestamp":1774493466517,"segment":0,"confidence":1.2405706887759003,"asi":{"hypothesis":"Object.keys(tree) allocates a ~99K-element array, then tree[key] per key does a string-hashed property lookup on a 99K-property object. Passing pre-built [key, node] pairs avoids both costs.","observed_effect":"hashTreeKeys dropped 5.6ms (22.8 → 17.2ms). Total improved 5.5ms. Array iteration with direct node references is significantly faster than Object.keys + property lookup on large objects.","mechanism":"treeEntries is built incrementally during buildPathGraph/buildFlattenedNodes/buildFolderNodes via push(). hashTreeKeys iterates it with a for loop, reading key and node from the tuple without touching the tree object for the main key loop."}}
{"run":85,"commit":"f908306","metric":61.721209,"metrics":{"worst_case_ms":50.165625,"buildPathGraph_ms":22.46221,"buildFlattenedNodes_ms":3.531999,"buildFolderNodes_ms":13.098166,"hashTreeKeys_ms":21.260084},"status":"discard","description":"Built Map from treeEntries for child reference lookups in hashTreeKeys.","timestamp":1774493516714,"segment":0,"confidence":1.2222761050902264,"asi":{"hypothesis":"Map.get might be faster than tree[key] property access for child reference resolution.","rollback_reason":"Regression +4.0ms. new Map(treeEntries) for 99K entries costs ~4ms upfront, exceeding any per-lookup savings. tree[key] is still faster for the ~90K child references.","next_action_hint":"The tree object remains the fastest lookup structure for child references. Focus on reducing the number of resolveId calls or eliminating child lookups entirely."}}
{"run":86,"commit":"f908306","metric":59.815877,"metrics":{"worst_case_ms":48.64475,"buildPathGraph_ms":22.573959,"buildFlattenedNodes_ms":3.44275,"buildFolderNodes_ms":13.798085,"hashTreeKeys_ms":18.891166},"status":"discard","description":"Two-pass hashTreeKeys: pass 1 pre-computes all IDs, pass 2 remaps children with guaranteed cache hits.","timestamp":1774493617451,"segment":0,"confidence":1.1989195636481582,"asi":{"hypothesis":"Separating ID computation from child remapping ensures resolveId always hits the fast path, enabling JIT to optimize the remapping loop.","rollback_reason":"Regression +2.1ms. Iterating 99K entries in pass 1 costs ~1.7ms. Only ~6K entries need ID computation; the 93K file entries just check-and-skip a Symbol property. The overhead of the extra pass exceeds the simpler resolveId benefit.","next_action_hint":"Single-pass with treeEntries is already optimal. The ~90K child references via tree[key]+NODE_ID read are the remaining cost."}}
{"run":87,"commit":"f908306","metric":59.018876,"metrics":{"worst_case_ms":48.38275,"buildPathGraph_ms":19.086707,"buildFlattenedNodes_ms":3.281832,"buildFolderNodes_ms":13.900167,"hashTreeKeys_ms":21.836668},"status":"discard","description":"Stored raw hash numbers on file nodes, deferred toString(36) to hashTreeKeys via typeof check in materializeId.","timestamp":1774493744296,"segment":0,"confidence":1.0910872225379138,"asi":{"hypothesis":"Deferring toString(36) from buildPathGraph to hashTreeKeys reduces allocation pressure in the path-scanning hot loop.","rollback_reason":"Net regression +1.3ms. typeof check on Symbol property in materializeId is slower than the previous null check. Three-way branch (string/number/null) hurts JIT compared to two-way (string/null).","next_action_hint":"Keep the single-type NODE_ID (always string). The typeof polymorphism hurts more than the deferred allocation saves.","finding":"Symbol property polymorphism (string | number) significantly degrades JIT optimization of the hot resolveId/materializeId path."}}
{"run":88,"commit":"25e0b57","metric":57.151458,"metrics":{"worst_case_ms":46.55475,"buildPathGraph_ms":22.826168,"buildFlattenedNodes_ms":3.42971,"buildFolderNodes_ms":13.132083,"hashTreeKeys_ms":16.879665},"status":"keep","description":"Replaced decorated.map(e => e.path) with pre-sized array + index loop in sortChildren to avoid per-element callback overhead.","timestamp":1774493790017,"segment":0,"confidence":1.0593419706086533,"asi":{"hypothesis":"new Array(n) + indexed assignment avoids .map() callback invocation overhead for the ~92K total children across ~6K sort calls.","observed_effect":"buildFolderNodes improved ~0.46ms (13.6 → 13.1ms). Total improved ~0.57ms."}}
{"run":89,"commit":"2a80c21","metric":56.097456,"metrics":{"worst_case_ms":45.729667,"buildPathGraph_ms":22.881043,"buildFlattenedNodes_ms":3.453835,"buildFolderNodes_ms":12.685749,"hashTreeKeys_ms":16.771584},"status":"keep","description":"Replaced children.map() decoration with pre-sized array + for loop in sortChildren to avoid callback overhead for ~92K decorated objects.","timestamp":1774493823608,"segment":0,"confidence":1.0368257373332015,"asi":{"hypothesis":"Pre-sized Array(n) + indexed for loop avoids .map() per-element callback invocation overhead during the decoration phase.","observed_effect":"buildFolderNodes improved 0.45ms (13.1 → 12.7ms). Total improved 1.05ms. Combined with previous .map() replacement, both decoration and extraction now use direct loops."}}
{"run":90,"commit":"2a80c21","metric":56.309792,"metrics":{"worst_case_ms":45.753416,"buildPathGraph_ms":22.752,"buildFlattenedNodes_ms":3.476957,"buildFolderNodes_ms":12.658917,"hashTreeKeys_ms":17.071999},"status":"discard","description":"Passed Sets directly to sortChildren instead of spreading to arrays, using for-of iteration in decoratedSort.","timestamp":1774493956662,"segment":0,"confidence":1.040005331891226,"asi":{"hypothesis":"Eliminating ~6K intermediate spread arrays by iterating Sets directly in decoratedSort.","rollback_reason":"No improvement (+0.21ms, noise). for...of Set iterator protocol overhead matches the saved spread cost. The simpler [...children] approach is equally fast.","next_action_hint":"Sort data flow is optimized. Focus on buildPathGraph (22.8ms, 41%) which is the dominant stage."}}
